{
  "id": "cscw",
  "conference": "CSCW",
  "full_name": "ACM Conference on Computer-Supported Cooperative Work and Social Computing",
  "installments": [
    {
      "year": 2025,
      "website": "https://cscw.acm.org/2025/index.php/submit-papers/",
      "cycles": [
        {
          "name": "July 2024 cycle",
          "dates": [
            {
              "date": "2024-07-02",
              "description": "Submission Deadline"
            },
            {
              "date": "2024-10-09",
              "description": "Notification"
            },
            {
              "date": "2024-10-29",
              "description": "Resubmission of Minor Revision Papers"
            },
            {
              "date": "2024-11-19",
              "description": "Notification"
            },
            {
              "date": "2024-12-10",
              "description": "Resubmission of Major Revision Papers"
            },
            {
              "date": "2025-02-12",
              "description": "Notification"
            },
            {
              "date": "2025-03-04",
              "description": "Resubmission of Minor Revision After Major Revisions"
            },
            {
              "date": "2025-03-26",
              "description": "Notification"
            }
          ]
        },
        {
          "name": "October 2024 cycle",
          "dates": [
            {
              "date": "2024-10-29",
              "description": "Submission Deadline"
            },
            {
              "date": "2025-02-12",
              "description": "Notification"
            },
            {
              "date": "2025-03-04",
              "description": "Resubmission of Minor Revision Papers"
            },
            {
              "date": "2025-03-26",
              "description": "Notification"
            },
            {
              "date": "2025-04-15",
              "description": "Resubmission of Major Revision Papers"
            },
            {
              "date": "2025-06-11",
              "description": "Notification"
            },
            {
              "date": "2025-07-01",
              "description": "Resubmission of Minor Revision After Major Revisions"
            },
            {
              "date": "2025-08-06",
              "description": "Notification"
            }
          ]
        }
      ]
    },
    {
      "year": 2026,
      "website": "https://cscw.acm.org/2026/papers.html",
      "cycles": [
        {
          "name": "May 2025 Cycle",
          "dates": [
            {
              "description": "New paper submissions due",
              "date": "2025-05-14"
            },
            {
              "description": "Expected notification date",
              "date": "2025-08-19"
            },
            {
              "description": "Resubmission: Revise for External Review",
              "date": "2025-09-16"
            },
            {
              "description": "Expected notification date (Outcomes: Conditional Accept, Revise and Resubmit, Reject)",
              "date": "2025-11-11"
            },
            {
              "description": "Resubmission: Major Revision",
              "date": "2026-01-13"
            },
            {
              "description": "Expected notification date (Outcomes: Conditional Accept, Reject)",
              "date": "2026-03-25?"
            }
          ]
        }
      ]
    },
    {
      "year": 2027,
      "website": "https://cscw.acm.org/2026/rolling.html",
      "cycles": [
        {
          "name": "Rolling Submissions",
          "is_rolling": true,
          "cycle_duration": 15,
          "dates": [
            {
              "description": "Submissions Open",
              "date": "2026-01-01"
            }
          ]
        }
      ]
    }
  ]
}
