{
    "id": "soups",
    "conference": "SOUPS",
    "full_name": "Symposium on Usable Privacy and Security",
    "installments": [
        {
            "year": 2025,
            "website": "https://www.usenix.org/conference/soups2025/call-for-papers",
            "cycles": [
                {
                    "name": "Papers",
                    "dates": [
                        {
                            "date": "2025-02-06",
                            "description": "Paper Submission Deadline"
                        },
                        {
                            "date": "2025-02-13",
                            "description": "Paper Submission Deadline"
                        },
                        {
                            "date": "2025-03-20",
                            "description": "Early Rejection Notification"
                        },
                        {
                            "date": "2025-04-17",
                            "description": "Author Response Period - Start"
                        },
                        {
                            "date": "2025-04-24",
                            "description": "Author Response Period - End"
                        },
                        {
                            "date": "2025-05-12",
                            "description": "Author Notification"
                        }
                    ]
                }
            ]
        },
        {
            "year": 2026,
            "website": "https://soups.page/",
            "cycles": [
                {
                    "name": "Papers",
                    "dates": [
                        {
                            "date": "2026-02-12",
                            "description": "Paper Registration Deadline"
                        },
                        {
                            "date": "2026-02-19",
                            "description": "Paper Submission Deadline"
                        },
                        {
                            "date": "2026-03-26",
                            "description": "Early Rejection Notification"
                        },
                        {
                            "date": "2026-04-23",
                            "description": "Author Response Period - Start"
                        },
                        {
                            "date": "2026-04-30",
                            "description": "Author Response Period - End"
                        },
                        {
                            "date": "2026-05-19",
                            "description": "Author Notification"
                        }
                    ]
                }
            ]
        }
    ]
}
