{
  "id": "oakland",
  "conference": "IEEE S&P",
  "full_name": "IEEE Symposium on Security and Privacy",
  "installments": [
    {
      "year": 2025,
      "website": "https://www.ieee-security.org/TC/SP2025/cfpapers.html",
      "cycles": [
        {
          "name": "First Deadline",
          "dates": [
            {
              "date": "2024-06-06",
              "description": "Paper Submission Deadline"
            },
            {
              "date": "2024-07-22",
              "description": "Early Rejection Notification"
            },
            {
              "date": "2024-08-19",
              "description": "Rebuttal Period - Start"
            },
            {
              "date": "2024-08-30",
              "description": "Rebuttal Period - End"
            },
            {
              "date": "2024-08-26",
              "description": "Rebuttal Deadline"
            },
            {
              "date": "2024-09-09",
              "description": "Author Notification"
            }
          ]
        },
        {
          "name": "Second Deadline",
          "dates": [
            {
              "date": "2024-11-14",
              "description": "Paper Submission Deadline"
            },
            {
              "date": "2025-01-20",
              "description": "Early Rejection Notification"
            },
            {
              "date": "2025-02-17",
              "description": "Rebuttal Period - Start"
            },
            {
              "date": "2025-02-28",
              "description": "Rebuttal Period - End"
            },
            {
              "date": "2025-02-24",
              "description": "Rebuttal Deadline"
            },
            {
              "date": "2025-03-10",
              "description": "Author Notification"
            }
          ]
        }
      ]
    },
    {
      "year": 2026,
      "website": "https://www.ieee-security.org/TC/SP2026/cfpapers.html",
      "cycles": [
        {
          "name": "First deadline",
          "dates": [
            {
              "date": "2025-05-29",
              "description": "Paper Registration Deadline"
            },
            {
              "description": "Paper Submission Deadline",
              "date": "2025-06-05"
            },
            {
              "description": "Early Reject Notification",
              "date": "2025-07-21"
            },
            {
              "description": "Rebuttal Period - Start",
              "date": "2025-08-18"
            },
            {
              "description": "Rebuttal text due",
              "date": "2025-08-25"
            },
            {
              "description": "Rebuttal Period - End",
              "date": "2025-08-29"
            },
            {
              "description": "Author Notification",
              "date": "2025-09-09"
            }
          ]
        },
        {
          "name": "Second deadline",
          "dates": [
            {
              "date": "2025-11-06",
              "description": "Paper Registration Deadline"
            },
            {
              "description": "Paper Submission Deadline",
              "date": "2025-11-13"
            },
            {
              "description": "Early Reject Notification",
              "date": "2026-01-19"
            },
            {
              "description": "Rebuttal Period - Start",
              "date": "2026-02-12"
            },
            {
              "description": "Rebuttal text due",
              "date": "2026-02-17"
            },
            {
              "description": "Rebuttal Period - End",
              "date": "2026-02-23"
            },
            {
              "description": "Author Notification",
              "date": "2026-03-09"
            }
          ]
        }
      ]
    },
    {
      "year": 2027,
      "website": "https://www.ieee-security.org/TC/SP2027/cfpapers.html",
      "cycles": [
        {
          "name": "First deadline",
          "dates": [
            {
              "date": "2026-06-04",
              "description": "Paper Registration Deadline"
            },
            {
              "date": "2026-06-11",
              "description": "Paper Submission Deadline"
            },
            {
              "date": "2026-07-27",
              "description": "Early Reject Notification"
            },
            {
              "date": "2026-08-20",
              "description": "Rebuttal Period - Start"
            },
            {
              "date": "2026-09-03",
              "description": "Rebuttal Period - End"
            },
            {
              "date": "2026-09-11",
              "description": "Author Notification"
            }
          ]
        },
        {
          "name": "Second deadline",
          "dates": [
            {
              "date": "2026-11-10",
              "description": "Paper Registration Deadline"
            },
            {
              "date": "2026-11-17",
              "description": "Paper Submission Deadline"
            },
            {
              "date": "2027-01-18",
              "description": "Early Reject Notification"
            },
            {
              "date": "2027-02-11",
              "description": "Rebuttal Period - Start"
            },
            {
              "date": "2027-02-25",
              "description": "Rebuttal Period - End"
            },
            {
              "date": "2027-03-05",
              "description": "Author Notification"
            }
          ]
        }
      ]
    }
  ]
}
