{
    "id": "ndss",
    "conference": "NDSS",
    "full_name": "Network and Distributed System Security Symposium",
    "installments": [
        {
            "year": 2025,
            "website": "https://www.ndss-symposium.org/ndss2025/submissions/call-for-papers/",
            "cycles": [
                {
                    "name": "Summer Review Cycle",
                    "dates": [
                        {
                            "date": "2024-04-17",
                            "description": "Paper Submission Deadline"
                        },
                        {
                            "date": "2024-05-21",
                            "description": "Early Rejection Notification"
                        },
                        {
                            "date": "2024-06-10",
                            "description": "Rebuttal Period - Start"
                        },
                        {
                            "date": "2024-06-13",
                            "description": "Rebuttal Period - End"
                        },
                        {
                            "date": "2024-06-10",
                            "description": "Interactive Discussion with Reviewers - Start"
                        },
                        {
                            "date": "2024-06-18",
                            "description": "Interactive Discussion with Reviewers - End"
                        },
                        {
                            "date": "2024-06-20",
                            "description": "Author Notification"
                        }
                    ]
                },
                {
                    "name": "Fall Review Cycle",
                    "dates": [
                        {
                            "date": "2024-07-10",
                            "description": "Paper Submission Deadline"
                        },
                        {
                            "date": "2024-08-20",
                            "description": "Early Rejection Notification"
                        },
                        {
                            "date": "2024-09-09",
                            "description": "Rebuttal Period - Start"
                        },
                        {
                            "date": "2024-09-13",
                            "description": "Rebuttal Period - End"
                        },
                        {
                            "date": "2024-09-09",
                            "description": "Interactive Discussion with Reviewers - Start"
                        },
                        {
                            "date": "2024-09-17",
                            "description": "Interactive Discussion with Reviewers - End"
                        },
                        {
                            "date": "2024-09-19",
                            "description": "Author Notification"
                        }
                    ]
                }
            ]
        },
        {
            "year": 2026,
            "website": "https://www.ndss-symposium.org/ndss2026/submissions/call-for-papers/",
            "cycles": [
                {
                    "name": "Summer Cycle",
                    "dates": [
                        {
                            "date": "2025-04-23",
                            "description": "Paper submission deadline"
                        },
                        {
                            "date": "2025-05-28",
                            "description": "Early reject/Round 2 notification and Round 1 reviews"
                        },
                        {
                            "date": "2025-06-18",
                            "description": "Author rebuttal - Start"
                        },
                        {
                            "date": "2025-06-20",
                            "description": "Author rebuttal - End"
                        },
                        {
                            "date": "2025-06-18",
                            "description": "Interactive discussion with reviewers - Start"
                        },
                        {
                            "date": "2025-06-25",
                            "description": "Interactive discussion with reviewers - End"
                        },
                        {
                            "date": "2025-07-02",
                            "description": "Author notification"
                        }
                    ]
                },
                {
                    "name": "Fall Cycle",
                    "dates": [
                        {
                            "date": "2025-08-06",
                            "description": "Paper submission deadline"
                        },
                        {
                            "date": "2025-09-17",
                            "description": "Early reject/Round 2 notification and Round 1 reviews"
                        },
                        {
                            "date": "2025-10-08",
                            "description": "Author rebuttal - Start"
                        },
                        {
                            "date": "2025-10-10",
                            "description": "Author rebuttal - End"
                        },
                        {
                            "date": "2025-10-08",
                            "description": "Interactive discussion with reviewers - Start"
                        },
                        {
                            "date": "2025-10-15",
                            "description": "Interactive discussion with reviewers - End"
                        },
                        {
                            "date": "2025-10-22",
                            "description": "Author notification"
                        }
                    ]
                }
            ]
        },
        {
            "year": 2027,
            "website": "https://www.ndss-symposium.org/ndss2027/submissions/call-for-papers/",
            "cycles": [
                {
                    "name": "Summer Cycle",
                    "dates": [
                        {
                            "date": "2026-05-06",
                            "description": "Paper submission deadline"
                        },
                        {
                            "date": "2026-06-12",
                            "description": "Early reject/Round 2 notification and Round 1 reviews"
                        },
                        {
                            "date": "2026-07-22",
                            "description": "Author notification"
                        },
                        {
                            "date": "2026-08-19",
                            "description": "Resubmission of Major Revision papers, Minor Revision decision"
                        },
                        {
                            "date": "2026-09-02",
                            "description": "Author notification for Major Revision"
                        },
                        {
                            "date": "2026-09-30",
                            "description": "Camera Ready deadline"
                        }
                    ]
                },
                {
                    "name": "Fall Cycle",
                    "dates": [
                        {
                            "date": "2026-08-19",
                            "description": "Paper submission deadline"
                        },
                        {
                            "date": "2026-09-25",
                            "description": "Early reject/Round 2 notification and Round 1 reviews"
                        },
                        {
                            "date": "2026-11-04",
                            "description": "Author notification"
                        },
                        {
                            "date": "2026-12-02",
                            "description": "Resubmission of Major Revision papers, Minor Revision decision"
                        },
                        {
                            "date": "2026-12-16",
                            "description": "Author notification for Major Revision"
                        },
                        {
                            "date": "2027-01-06",
                            "description": "Camera Ready deadline"
                        }
                    ]
                }
            ]
        }
    ]
}
