{
    "id": "usenix",
    "conference": "USENIX",
    "full_name": "USENIX Security Symposium",
    "installments": [
        {
            "year": 2025,
            "website": "https://www.usenix.org/conference/usenixsecurity25/call-for-papers",
            "cycles": [
                {
                    "name": "Cycle 1",
                    "dates": [
                        {
                            "date": "2024-09-04",
                            "description": "Paper Submission Deadline"
                        },
                        {
                            "date": "2024-10-15",
                            "description": "Early Rejection Notification"
                        },
                        {
                            "date": "2024-11-18",
                            "description": "Rebuttal Period - Start"
                        },
                        {
                            "date": "2024-11-25",
                            "description": "Rebuttal Period - End"
                        },
                        {
                            "date": "2024-12-11",
                            "description": "Author Notification"
                        }
                    ]
                },
                {
                    "name": "Cycle 2",
                    "dates": [
                        {
                            "date": "2025-01-22",
                            "description": "Paper Submission Deadline"
                        },
                        {
                            "date": "2025-03-04",
                            "description": "Early Rejection Notification"
                        },
                        {
                            "date": "2025-04-07",
                            "description": "Rebuttal Period - Start"
                        },
                        {
                            "date": "2025-04-14",
                            "description": "Rebuttal Period - End"
                        },
                        {
                            "date": "2025-04-30",
                            "description": "Author Notification"
                        }
                    ]
                }
            ]
        },
        {
            "year": 2026,
            "website": "https://www.usenix.org/conference/usenixsecurity26/",
            "cycles": [
                {
                    "name": "Cycle 1",
                    "dates": [
                        {
                            "date": "2025-08-19",
                            "description": "Paper Registration Deadline"
                        },
                        {
                            "date": "2025-08-26",
                            "description": "Paper Submission Deadline"
                        },
                        {
                            "date": "2025-10-07",
                            "description": "Early Rejection Notification"
                        },
                        {
                            "date": "2025-11-06",
                            "description": "Rebuttal Period - Start"
                        },
                        {
                            "date": "2025-11-13",
                            "description": "Rebuttal Period - End"
                        },
                        {
                            "date": "2025-12-04",
                            "description": "Author Notification"
                        }
                    ]
                },
                {
                    "name": "Cycle 2",
                    "dates": [
                        {
                            "date": "2026-01-29",
                            "description": "Paper Registration Deadline"
                        },
                        {
                            "date": "2026-02-05",
                            "description": "Paper Submission Deadline"
                        },
                        {
                            "date": "2026-03-17",
                            "description": "Early Rejection Notification"
                        },
                        {
                            "date": "2026-04-16",
                            "description": "Rebuttal Period - Start"
                        },
                        {
                            "date": "2026-04-23",
                            "description": "Rebuttal Period - End"
                        },
                        {
                            "date": "2026-05-14",
                            "description": "Author Notification"
                        }
                    ]
                }
            ]
        },
        {
            "year": 2027,
            "website": "https://www.usenix.org/conference/usenixsecurity27/",
            "cycles": [
                {
                    "name": "Cycle 1",
                    "dates": [
                        {
                            "date": "2026-08-18",
                            "description": "Paper Registration Deadline"
                        },
                        {
                            "date": "2026-08-25",
                            "description": "Paper Submission Deadline"
                        },
                        {
                            "date": "2026-10-06?",
                            "description": "Early Rejection Notification"
                        },
                        {
                            "date": "2026-11-05?",
                            "description": "Rebuttal Period - Start"
                        },
                        {
                            "date": "2026-11-12?",
                            "description": "Rebuttal Period - End"
                        },
                        {
                            "date": "2026-12-03?",
                            "description": "Author Notification"
                        }
                    ]
                },
                {
                    "name": "Cycle 2",
                    "dates": [
                        {
                            "date": "2027-01-19",
                            "description": "Paper Registration Deadline"
                        },
                        {
                            "date": "2027-01-26",
                            "description": "Paper Submission Deadline"
                        },
                        {
                            "date": "2027-03-07?",
                            "description": "Early Rejection Notification"
                        },
                        {
                            "date": "2027-04-06?",
                            "description": "Rebuttal Period - Start"
                        },
                        {
                            "date": "2027-04-13?",
                            "description": "Rebuttal Period - End"
                        },
                        {
                            "date": "2027-05-04?",
                            "description": "Author Notification"
                        }
                    ]
                }
            ]
        }
    ]
}
