{
    "id": "chi",
    "conference": "CHI",
    "full_name": "ACM CHI Conference on Human Factors in Computing Systems",
    "installments": [
        {
            "year": 2025,
            "website": "https://chi2025.acm.org/for-authors/papers/",
            "cycles": [
                {
                    "name": "Papers",
                    "dates": [
                        {
                            "date": "2024-09-05",
                            "description": "Abstract/Metadata Deadline"
                        },
                        {
                            "date": "2024-09-12",
                            "description": "Full Paper Submission Deadline"
                        },
                        {
                            "date": "2025-01-16",
                            "description": "Author Notification"
                        }
                    ]
                }
            ]
        },
        {
            "year": 2026,
            "website": "https://chi2026.acm.org/",
            "cycles": [
                {
                    "name": "Papers",
                    "dates": [
                        {
                            "date": "2025-09-04",
                            "description": "Paper Registration Deadline"
                        },
                        {
                            "date": "2025-09-11",
                            "description": "Full Paper Submission Deadline"
                        },
                        {
                            "date": "2025-11-04",
                            "description": "Reviews Released"
                        },
                        {
                            "date": "2025-12-04",
                            "description": "Resubmission Due"
                        },
                        {
                            "date": "2026-01-15",
                            "description": "Author Notification"
                        }
                    ]
                }
            ]
        }
    ]
}
