{
    "id": "eurousec",
    "conference": "EuroUSEC",
    "full_name": "European Symposium on Usable Security",
    "installments": [
        {
            "year": 2025,
            "website": "https://eurousec2025.cis.strath.ac.uk/#cfpapers",
            "cycles": [
                {
                    "name": "Papers",
                    "dates": [
                        {
                            "date": "2025-05-05",
                            "description": "Paper Registration Deadline"
                        },
                        {
                            "date": "2025-05-09",
                            "description": "Paper Submission Deadline"
                        },
                        {
                            "date": "2025-06-16",
                            "description": "Author Notification"
                        }
                    ]
                }
            ]
        }
    ]
}
